{
    "items": [
        {
            "id": "prod_123",
            "name": "Wireless Headphones",
            "description": "High-quality wireless headphones with noise cancellation",
            "quantity": 1,
            "unit_price": 199.99,
            "total_price": 199.99,
            "category": "Electronics",
            "sku": "WH-001-BLK"
        },
        {
            "id": "prod_456",
            "name": "Phone Case",
            "description": "Protective case for smartphone",
            "quantity": 2,
            "unit_price": 29.99,
            "total_price": 59.98,
            "category": "Accessories",
            "sku": "PC-002-CLR"
        }
    ],
    "amount": 259.97,
    "currency": "USD",
    "mcc": "5733",
    "geo": {
        "country": "US",
        "region": "CA",
        "city": "San Francisco",
        "latitude": 37.7749,
        "longitude": -122.4194,
        "timezone": "America/Los_Angeles"
    },
    "risk_flags": [
        "low"
    ],
    "metadata": {
        "cart_id": "cart_xyz789",
        "discount_code": "SAVE10",
        "shipping_method": "standard"
    }
}
